{
  "$schema": "http://json-schema.org/draft-07/schema#",
  "$id": "https://agentreflex.dev/schema/reflex-v1.json",
  "title": "agentreflex reflex manifest (v1)",
  "description": "Manifest for an official agentreflex reflex (reflex.json).",
  "type": "object",
  "required": ["name", "title", "description", "events", "capabilities", "entry"],
  "additionalProperties": false,
  "properties": {
    "$schema": {
      "type": "string",
      "description": "Reference to this schema for editor validation."
    },
    "name": {
      "type": "string",
      "pattern": "^[a-z][a-z0-9-]*$",
      "description": "Unique reflex id. Lowercase kebab-case; must match the folder name."
    },
    "title": {
      "type": "string",
      "minLength": 1,
      "description": "Short human-readable name shown in the catalog."
    },
    "description": {
      "type": "string",
      "minLength": 1,
      "description": "One sentence: what this reflex catches or does."
    },
    "version": {
      "type": "string",
      "description": "Semver. Official reflexes track the monorepo via release-please."
    },
    "license": {
      "type": "string",
      "description": "SPDX license id. Official reflexes are MIT."
    },
    "author": {
      "type": "string",
      "description": "Author or org. 'agentreflex' for official reflexes."
    },
    "official": {
      "type": "boolean",
      "description": "True for reflexes that ship in the commons (/reflexes)."
    },
    "events": {
      "type": "array",
      "minItems": 1,
      "uniqueItems": true,
      "items": { "enum": ["onToolCall", "onToolResult"] },
      "description": "Lifecycle events this reflex handles. Must match the handlers it exports."
    },
    "capabilities": {
      "type": "object",
      "additionalProperties": false,
      "required": ["decisions"],
      "properties": {
        "decisions": {
          "type": "array",
          "uniqueItems": true,
          "items": { "enum": ["pass", "deny", "ask", "modify"] },
          "description": "Verdicts this reflex can return. Declare only what it actually emits."
        },
        "reads": {
          "type": "array",
          "uniqueItems": true,
          "items": { "enum": ["command", "paths", "cwd", "raw"] },
          "description": "Context fields this reflex inspects."
        },
        "writes": {
          "type": "array",
          "uniqueItems": true,
          "items": { "type": "string" },
          "description": "Side effects (e.g. files the reflex snapshots). For onToolResult reflexes."
        }
      }
    },
    "entry": {
      "type": "string",
      "description": "Path to the built entry module, relative to the reflex folder (e.g. dist/index.js)."
    },
    "tags": {
      "type": "array",
      "uniqueItems": true,
      "items": { "type": "string" },
      "description": "Catalog facets (e.g. security, git, protective, proactive)."
    },
    "options": {
      "type": "object",
      "description": "Config this reflex accepts via `.reflex/config.json` `with`, surfaced as `ctx.options`. Each key documents one option.",
      "additionalProperties": {
        "type": "object",
        "properties": {
          "type": { "type": "string" },
          "description": { "type": "string" },
          "required": { "type": "boolean" }
        }
      }
    }
  }
}
