{
  "$schema": "https://agentreflex.dev/schema/reflex-v1.json",
  "name": "no-rm-rf",
  "title": "No rm -rf disasters",
  "description": "Blocks recursive rm of dangerous targets — /, home, system dirs, or a bare *.",
  "version": "0.0.0",
  "license": "MIT",
  "author": "agentreflex",
  "official": true,
  "events": ["onToolCall"],
  "capabilities": {
    "decisions": ["deny"],
    "reads": ["command"]
  },
  "entry": "dist/index.js",
  "tags": ["safety", "shell", "protective"]
}
